Sheet: 到货通知单
B1: KSA INTERNATIONAL INC.
B6: ARRIVAL NOTICE / DEBIT NOTE
H7: DATE. | I7: ${model.date!}
H8: NO. | I8: ${model.code!}
A9: MESSERS：
B10: ${model.consignee!}
A15: SHIPPER NAME:
B16: ${model.shipper!}
A19: VESSEL： | C19: ${model.vessel!} | E19: VOY NO. | F19: ${model.voyage!} | H19: ETA: | I19: ${model.eta!}
A21: M B/L NO. | C21: ${model.mawb!} | F21: CONTAINER NO. | G21: ${model.container!} | K21: CY
A22: H B/L NO. | C22: ${model.hawb!} | F22: SEAL NO. | G22: ${model.seal!} | K22: ${model.cy!}
A24: PORT OF LOADING: | F24: PORT OF DISCHARGE: | H24: ${model.dischargePort!}
B25: ${model.loadingPort!} | F25: PLACE OF DELIVERY: | H25: ${model.deliverPlace!}
B27: MARKS | D27: DESCRIPTION | G27: P'KG | I27: KGS./M3
B28: ${model.cargoMark!} | D28: SHIPPER'S LOAD, COUNT & SEAL | G28: ${model.cargo!}
D29: (${model.count!})CONTAINER S.T.C. | I29: ${model.cargoWeight!} | J29: KGS
D30: ${model.cargoDescription!} | I30: ${model.cargoVolumn!} | J30: M3
G33: (${model.pkg!})
D35: "FREIGHT: | E35: ${model.freight!} | F35: "
A36: CHARGE: | C36: ${model.charge!} | E36: EX. CHANGE RATE: | G36: ${model.rate!}
F37: 単価 | H37: 数量 | J37: 合計
C38: 海上運賃 | E38: US$ | F38: 0 | G38: ｘ | H38: 1 | I38: = | J38: =SUM(R[-2]C[-4]*RC[-4]*RC[-2]) -> 0
C39: FAF | F39: 28800 | G39: ｘ | H39: 2 | I39: = | J39: =RC[-4]*RC[-2] -> 57600
C40: YAS | F40: 3600 | G40: ｘ | H40: 2 | I40: = | J40: =RC[-4]*RC[-2] -> 7200
C41: EBS | F41: 7200 | G41: ｘ | H41: 2 | I41: = | J41: =RC[-4]*RC[-2] -> 14400
C42: D/O FEE | F42: 2500 | G42: ｘ | H42: 1 | I42: = | J42: =(RC[-4]*RC[-2]) -> 2500
C43: CY CHARGE | F43: 24200 | G43: ｘ | H43: 2 | I43: = | J43: =(RC[-4]*RC[-2]) -> 48400
C44: DOC FEE | F44: 2000 | G44: ｘ | H44: 1 | I44: = | J44: =(RC[-4]*RC[-2]) -> 2000
J45: =SUM(R[-7]C:R[-1]C) -> 132100
C46: *****************************************************************************
C47: 振込先： | D47: 三菱東京ＵＦＪ銀行 西院支店 | G47: 諸費用は弊社へお振込ください。
D48: 当座 番号 ９０００７７７ | G48: 振込明細のFAXを頂けますとD/O切替書類を
D49: （株）ＫＳＡインターナショナル | G49: 折り返しFAXさせていただきます。
C50: 住所：〒604-8824 | G50: *小切手の持込は受け付けておりません。
D51: 京都市中京区壬生高樋町13番地
E52: TEL:075-821-2702
E53: FAX:075-821-2703 | G53: 担当：加藤
C54: *****************************************************************************
C55: CY : | D55: OHI B/A NO.1-2CY | G55: D/O切替場所： | H55: LESS
D56: CODE:1FD01
D57: TEL:03-3790-8063
D58: FAX:03-3790-5243